[
  {
    "sweep_id": "SWEEP_001",
    "ceremony_id": "CEREMONY_001",
    "creator_id": "CRT_NEL_BLU_DIPINTO",
    "sweep_achievement_type": "Big Four Clean Sweep",
    "aoty_nomination_id": "NOM_001_RECORD_OF__0000",
    "roty_nomination_id": "NOM_001_RECORD_OF__0000",
    "soty_nomination_id": "NOM_001_RECORD_OF__0000",
    "bna_nomination_id": "NOM_001_RECORD_OF__0000",
    "sweep_calendar_year": 1959,
    "career_significance_rating": "Historic Academic Benchmark Achievement"
  },
  {
    "sweep_id": "SWEEP_002",
    "ceremony_id": "CEREMONY_001",
    "creator_id": "CRT_HENRY_MANCINI",
    "sweep_achievement_type": "Triple Crown",
    "aoty_nomination_id": "NOM_001_ALBUM_OF_T_0001",
    "roty_nomination_id": "NOM_001_ALBUM_OF_T_0001",
    "soty_nomination_id": "NOM_001_ALBUM_OF_T_0001",
    "bna_nomination_id": "NOM_001_ALBUM_OF_T_0001",
    "sweep_calendar_year": 1959,
    "career_significance_rating": "Historic Academic Benchmark Achievement"
  },
  {
    "sweep_id": "SWEEP_003",
    "ceremony_id": "CEREMONY_001",
    "creator_id": "CRT_NEL_BLU_DIPINTO",
    "sweep_achievement_type": "Triple Crown",
    "aoty_nomination_id": "NOM_001_SONG_OF_TH_0002",
    "roty_nomination_id": "NOM_001_SONG_OF_TH_0002",
    "soty_nomination_id": "NOM_001_SONG_OF_TH_0002",
    "bna_nomination_id": "NOM_001_SONG_OF_TH_0002",
    "sweep_calendar_year": 1959,
    "career_significance_rating": "Historic Academic Benchmark Achievement"
  },
  {
    "sweep_id": "SWEEP_004",
    "ceremony_id": "CEREMONY_001",
    "creator_id": "CRT_ELLA_FITZGERALD",
    "sweep_achievement_type": "Triple Crown",
    "aoty_nomination_id": "NOM_001_BEST_VOCAL_0003",
    "roty_nomination_id": "NOM_001_BEST_VOCAL_0003",
    "soty_nomination_id": "NOM_001_BEST_VOCAL_0003",
    "bna_nomination_id": "NOM_001_BEST_VOCAL_0003",
    "sweep_calendar_year": 1959,
    "career_significance_rating": "Historic Academic Benchmark Achievement"
  },
  {
    "sweep_id": "SWEEP_005",
    "ceremony_id": "CEREMONY_001",
    "creator_id": "CRT_CATCH_A_FALLING",
    "sweep_achievement_type": "Big Four Clean Sweep",
    "aoty_nomination_id": "NOM_001_BEST_VOCAL_0004",
    "roty_nomination_id": "NOM_001_BEST_VOCAL_0004",
    "soty_nomination_id": "NOM_001_BEST_VOCAL_0004",
    "bna_nomination_id": "NOM_001_BEST_VOCAL_0004",
    "sweep_calendar_year": 1959,
    "career_significance_rating": "Historic Academic Benchmark Achievement"
  },
  {
    "sweep_id": "SWEEP_006",
    "ceremony_id": "CEREMONY_001",
    "creator_id": "CRT_BILLY_MAY_S_BIG",
    "sweep_achievement_type": "Triple Crown",
    "aoty_nomination_id": "NOM_001_BEST_PERFO_0005",
    "roty_nomination_id": "NOM_001_BEST_PERFO_0005",
    "soty_nomination_id": "NOM_001_BEST_PERFO_0005",
    "bna_nomination_id": "NOM_001_BEST_PERFO_0005",
    "sweep_calendar_year": 1959,
    "career_significance_rating": "Historic Academic Benchmark Achievement"
  },
  {
    "sweep_id": "SWEEP_007",
    "ceremony_id": "CEREMONY_001",
    "creator_id": "CRT_BASIE",
    "sweep_achievement_type": "Triple Crown",
    "aoty_nomination_id": "NOM_001_BEST_PERFO_0006",
    "roty_nomination_id": "NOM_001_BEST_PERFO_0006",
    "soty_nomination_id": "NOM_001_BEST_PERFO_0006",
    "bna_nomination_id": "NOM_001_BEST_PERFO_0006",
    "sweep_calendar_year": 1959,
    "career_significance_rating": "Historic Academic Benchmark Achievement"
  },
  {
    "sweep_id": "SWEEP_008",
    "ceremony_id": "CEREMONY_001",
    "creator_id": "CRT_THAT_OLD_BLACK_",
    "sweep_achievement_type": "Triple Crown",
    "aoty_nomination_id": "NOM_001_BEST_PERFO_0007",
    "roty_nomination_id": "NOM_001_BEST_PERFO_0007",
    "soty_nomination_id": "NOM_001_BEST_PERFO_0007",
    "bna_nomination_id": "NOM_001_BEST_PERFO_0007",
    "sweep_calendar_year": 1959,
    "career_significance_rating": "Historic Academic Benchmark Achievement"
  },
  {
    "sweep_id": "SWEEP_009",
    "ceremony_id": "CEREMONY_001",
    "creator_id": "CRT_ELLA_FITZGERALD",
    "sweep_achievement_type": "Big Four Clean Sweep",
    "aoty_nomination_id": "NOM_001_BEST_JAZZ__0008",
    "roty_nomination_id": "NOM_001_BEST_JAZZ__0008",
    "soty_nomination_id": "NOM_001_BEST_JAZZ__0008",
    "bna_nomination_id": "NOM_001_BEST_JAZZ__0008",
    "sweep_calendar_year": 1959,
    "career_significance_rating": "Historic Academic Benchmark Achievement"
  },
  {
    "sweep_id": "SWEEP_010",
    "ceremony_id": "CEREMONY_001",
    "creator_id": "CRT_BASIE",
    "sweep_achievement_type": "Triple Crown",
    "aoty_nomination_id": "NOM_001_BEST_JAZZ__0009",
    "roty_nomination_id": "NOM_001_BEST_JAZZ__0009",
    "soty_nomination_id": "NOM_001_BEST_JAZZ__0009",
    "bna_nomination_id": "NOM_001_BEST_JAZZ__0009",
    "sweep_calendar_year": 1959,
    "career_significance_rating": "Historic Academic Benchmark Achievement"
  },
  {
    "sweep_id": "SWEEP_011",
    "ceremony_id": "CEREMONY_001",
    "creator_id": "CRT_THE_CHIPMUNK_SO",
    "sweep_achievement_type": "Triple Crown",
    "aoty_nomination_id": "NOM_001_BEST_COMED_0010",
    "roty_nomination_id": "NOM_001_BEST_COMED_0010",
    "soty_nomination_id": "NOM_001_BEST_COMED_0010",
    "bna_nomination_id": "NOM_001_BEST_COMED_0010",
    "sweep_calendar_year": 1959,
    "career_significance_rating": "Historic Academic Benchmark Achievement"
  },
  {
    "sweep_id": "SWEEP_012",
    "ceremony_id": "CEREMONY_001",
    "creator_id": "CRT_TOM_DOOLEY",
    "sweep_achievement_type": "Triple Crown",
    "aoty_nomination_id": "NOM_001_BEST_COUNT_0011",
    "roty_nomination_id": "NOM_001_BEST_COUNT_0011",
    "soty_nomination_id": "NOM_001_BEST_COUNT_0011",
    "bna_nomination_id": "NOM_001_BEST_COUNT_0011",
    "sweep_calendar_year": 1959,
    "career_significance_rating": "Historic Academic Benchmark Achievement"
  },
  {
    "sweep_id": "SWEEP_013",
    "ceremony_id": "CEREMONY_001",
    "creator_id": "CRT_TEQUILA",
    "sweep_achievement_type": "Big Four Clean Sweep",
    "aoty_nomination_id": "NOM_001_BEST_RHYTH_0012",
    "roty_nomination_id": "NOM_001_BEST_RHYTH_0012",
    "soty_nomination_id": "NOM_001_BEST_RHYTH_0012",
    "bna_nomination_id": "NOM_001_BEST_RHYTH_0012",
    "sweep_calendar_year": 1959,
    "career_significance_rating": "Historic Academic Benchmark Achievement"
  },
  {
    "sweep_id": "SWEEP_014",
    "ceremony_id": "CEREMONY_001",
    "creator_id": "CRT_HENRY_MANCINI",
    "sweep_achievement_type": "Triple Crown",
    "aoty_nomination_id": "NOM_001_BEST_ARRAN_0013",
    "roty_nomination_id": "NOM_001_BEST_ARRAN_0013",
    "soty_nomination_id": "NOM_001_BEST_ARRAN_0013",
    "bna_nomination_id": "NOM_001_BEST_ARRAN_0013",
    "sweep_calendar_year": 1959,
    "career_significance_rating": "Historic Academic Benchmark Achievement"
  },
  {
    "sweep_id": "SWEEP_015",
    "ceremony_id": "CEREMONY_001",
    "creator_id": "CRT_DUETS_WITH_A_SP",
    "sweep_achievement_type": "Triple Crown",
    "aoty_nomination_id": "NOM_001_BEST_ENGIN_0014",
    "roty_nomination_id": "NOM_001_BEST_ENGIN_0014",
    "soty_nomination_id": "NOM_001_BEST_ENGIN_0014",
    "bna_nomination_id": "NOM_001_BEST_ENGIN_0014",
    "sweep_calendar_year": 1959,
    "career_significance_rating": "Historic Academic Benchmark Achievement"
  },
  {
    "sweep_id": "SWEEP_016",
    "ceremony_id": "CEREMONY_001",
    "creator_id": "CRT_THE_CHIPMUNK_SO",
    "sweep_achievement_type": "Triple Crown",
    "aoty_nomination_id": "NOM_001_BEST_ENGIN_0015",
    "roty_nomination_id": "NOM_001_BEST_ENGIN_0015",
    "soty_nomination_id": "NOM_001_BEST_ENGIN_0015",
    "bna_nomination_id": "NOM_001_BEST_ENGIN_0015",
    "sweep_calendar_year": 1959,
    "career_significance_rating": "Historic Academic Benchmark Achievement"
  },
  {
    "sweep_id": "SWEEP_017",
    "ceremony_id": "CEREMONY_001",
    "creator_id": "CRT_FRANK_SINATRA",
    "sweep_achievement_type": "Big Four Clean Sweep",
    "aoty_nomination_id": "NOM_001_BEST_ALBUM_0016",
    "roty_nomination_id": "NOM_001_BEST_ALBUM_0016",
    "soty_nomination_id": "NOM_001_BEST_ALBUM_0016",
    "bna_nomination_id": "NOM_001_BEST_ALBUM_0016",
    "sweep_calendar_year": 1959,
    "career_significance_rating": "Historic Academic Benchmark Achievement"
  },
  {
    "sweep_id": "SWEEP_018",
    "ceremony_id": "CEREMONY_001",
    "creator_id": "CRT_CROSS_COUNTRY_S",
    "sweep_achievement_type": "Triple Crown",
    "aoty_nomination_id": "NOM_001_BEST_MUSIC_0017",
    "roty_nomination_id": "NOM_001_BEST_MUSIC_0017",
    "soty_nomination_id": "NOM_001_BEST_MUSIC_0017",
    "bna_nomination_id": "NOM_001_BEST_MUSIC_0017",
    "sweep_calendar_year": 1959,
    "career_significance_rating": "Historic Academic Benchmark Achievement"
  },
  {
    "sweep_id": "SWEEP_019",
    "ceremony_id": "CEREMONY_001",
    "creator_id": "CRT_THE_MUSIC_MAN",
    "sweep_achievement_type": "Triple Crown",
    "aoty_nomination_id": "NOM_001_BEST_ORIGI_0018",
    "roty_nomination_id": "NOM_001_BEST_ORIGI_0018",
    "soty_nomination_id": "NOM_001_BEST_ORIGI_0018",
    "bna_nomination_id": "NOM_001_BEST_ORIGI_0018",
    "sweep_calendar_year": 1959,
    "career_significance_rating": "Historic Academic Benchmark Achievement"
  },
  {
    "sweep_id": "SWEEP_020",
    "ceremony_id": "CEREMONY_001",
    "creator_id": "CRT_ANDR_PREVIN",
    "sweep_achievement_type": "Triple Crown",
    "aoty_nomination_id": "NOM_001_BEST_SOUND_0019",
    "roty_nomination_id": "NOM_001_BEST_SOUND_0019",
    "soty_nomination_id": "NOM_001_BEST_SOUND_0019",
    "bna_nomination_id": "NOM_001_BEST_SOUND_0019",
    "sweep_calendar_year": 1959,
    "career_significance_rating": "Historic Academic Benchmark Achievement"
  },
  {
    "sweep_id": "SWEEP_021",
    "ceremony_id": "CEREMONY_001",
    "creator_id": "CRT_THE_BEST_OF_THE",
    "sweep_achievement_type": "Big Four Clean Sweep",
    "aoty_nomination_id": "NOM_001_BEST_PERFO_0020",
    "roty_nomination_id": "NOM_001_BEST_PERFO_0020",
    "soty_nomination_id": "NOM_001_BEST_PERFO_0020",
    "bna_nomination_id": "NOM_001_BEST_PERFO_0020",